{"$schema":"https://json-schema.org/draft/2020-12/schema","type":"array","minItems":1,"maxItems":100,"items":{"type":"object","additionalProperties":false,"required":["id","version","kind","title","description","owner","dimensions","roles","preconditions"],"properties":{"id":{"type":"string","pattern":"^[a-z][a-z0-9_]{2,63}$"},"version":{"type":"integer","minimum":1},"kind":{"enum":["metric","domain","capability"]},"title":{"type":"string","minLength":1},"description":{"type":"string","minLength":1},"owner":{"type":"string","minLength":1},"unit":{"type":"string"},"formula":{"type":"string"},"timestamp":{"type":"string"},"dimensions":{"type":"array","items":{"type":"string"},"uniqueItems":true},"roles":{"type":"array","minItems":1,"items":{"type":"string"}},"preconditions":{"type":"array","minItems":1,"items":{"type":"string"}},"input_contract":{"type":"string"},"output_contract":{"type":"string"},"idempotency":{"type":"string"},"reversibility":{"type":"string"},"compensation":{"type":"string"}}}}
