[
  {"id":"pending_index_age_seconds","version":1,"kind":"metric","title":"Pending index age","description":"Oldest currently eligible unprocessed knowledge index intent, with backlog and exhausted failures. Zero age when none. Snapshot metric; the requested window does not filter backlog.","owner":"platform-operations","unit":"seconds","formula":"max(now - created_at) for eligible unprocessed non-exhausted intents; zero if empty","timestamp":"query snapshot","dimensions":[],"roles":["operations","product_owner","qa","controller","development"],"preconditions":["approved current registry","project authorization","fresh definition"]},
  {"id":"candidate_validation_rate","version":1,"kind":"metric","title":"Candidate validation rate","description":"Passing latest completed report per candidate version among reports completed in the half-open UTC window. No reports produces null, not zero. Failed verifier attempts without completed reports are observable in traces but excluded.","owner":"platform-quality","unit":"ratio","formula":"passing latest reports / latest completed reports","timestamp":"knowledge_validations.completed_at","dimensions":["task_type"],"roles":["operations","product_owner","qa","controller","development"],"preconditions":["approved current registry","project authorization","fresh definition"]},
  {"id":"candidate_approval_rate","version":1,"kind":"metric","title":"Candidate approval rate","description":"Approve decisions divided by all approve and reject decisions in the half-open UTC window. Idempotent retries do not create decisions. Empty denominator is null.","owner":"platform-product","unit":"ratio","formula":"approve / (approve + reject)","timestamp":"knowledge_decisions.created_at","dimensions":["task_type"],"roles":["operations","product_owner","qa","controller","development"],"preconditions":["approved current registry","project authorization","fresh definition"]},
  {"id":"validated_reuse_rate","version":1,"kind":"metric","title":"Validated reuse rate","description":"Completed tasks with trusted passing local validation and explicitly recorded eligible used context divided by completed locally validated tasks. A search hit alone is not reuse. Eight of twenty is 0.4 (40%). This is observational, not causal attribution.","owner":"platform-quality","unit":"ratio","formula":"locally validated completed tasks with used_context / locally validated completed tasks","timestamp":"workflow_task_checkpoints.completed_at","dimensions":["task_type"],"roles":["operations","product_owner","qa","controller","development"],"preconditions":["approved current registry","project authorization","fresh definition","explicit context-use receipt and action-time eligibility"]},
  {"id":"software_knowledge","version":1,"kind":"domain","title":"Governed software knowledge","description":"PostgreSQL owns exact versions, sources, validations and accountable decisions. Milvus is a replaceable semantic candidate projection; all results must be hydrated and quality checked.","owner":"platform-quality","dimensions":[],"roles":["operations","product_owner","qa","controller","development"],"preconditions":["approved knowledge only","purpose-specific source and content freshness","current embedding manifest"]},
  {"id":"knowledge_promotion","version":1,"kind":"capability","title":"Promote validated knowledge","description":"knowledge_candidate_decide is implemented by Service.DecideKnowledge with the versioned decision contract. TestKnowledgePromotionTransactionIntegration in internal/postgres/validation_integration_test.go validates its storage invariants. Registry validation is not a claim that this integration test just ran.","owner":"platform-product","dimensions":[],"roles":["product_owner"],"preconditions":["active accountable human","passing fresh validation","source verification","role separation where required"],"input_contract":"knowledge/v1/decision.schema.json","output_contract":"knowledge item exact version and approval receipt","idempotency":"knowledge ID plus key; changed payload conflicts","reversibility":"approval history is immutable; invalid knowledge is quarantined","compensation":"revalidate a new version; retry failed projection after resolving cause"}
]
